{"displayProfile":"additive","gestureDictionaryVersion":"v1","layers":[{"bundleUrl":"phone-local://presets/preset_retail_spring_01/layer_01.glb","despawnAtMs":9000,"fadeInMs":400,"fadeOutMs":600,"initialState":"Appear","layerId":"layer_01","placement":{"mode":"headLocked","offset":[0.0,0.1,0.6]},"spawnAtMs":0},{"bundleUrl":"phone-local://presets/preset_retail_spring_01/layer_02.glb","despawnAtMs":15000,"fadeInMs":400,"fadeOutMs":800,"initialState":"Appear","layerId":"layer_02","placement":{"mode":"headLocked","offset":[0.25,-0.05,0.7]},"spawnAtMs":5000}],"manifestVersion":"2.0","presetId":"preset_retail_spring_01","timing":{"durationMs":15000,"loop":false,"maxLoops":1,"onEnd":"close"},"transition":{"durationMs":300,"type":"fade"}}